{"api_version":"comparo.report/v1alpha1","format":"json","artifact_api_version":"comparo.artifact/v1alpha1","artifact_id":"artifact-0","artifact":{"api_version":"comparo.artifact/v1alpha1","metadata":{"artifact_id":"artifact-0","run_id":"run-0","invocation_id":"invocation-0","created_unix_nanoseconds":1,"tool_name":"comparo","tool_version":"0.2.0","configuration_api_version":"comparo/v1alpha1","sanitizer_version":"comparo.sanitizer/v1alpha1","credential_catalog_version":"comparo.credentials/v1alpha1"},"provenance":{"project":{"namespace":"default","kind":"Project","resource_id":"project","fingerprint":"aaaaaaaaaaaaaaaaaaaaaaaaaaaaaaaaaaaaaaaaaaaaaaaaaaaaaaaaaaaaaaaa"},"execution_policy":{"namespace":"default","kind":"ExecutionPolicy","resource_id":"ci","fingerprint":"aaaaaaaaaaaaaaaaaaaaaaaaaaaaaaaaaaaaaaaaaaaaaaaaaaaaaaaaaaaaaaaa"},"artifact_profile":null,"redaction_profile":null,"configuration_fingerprint":"dddddddddddddddddddddddddddddddddddddddddddddddddddddddddddddddd","plan_fingerprint":"eeeeeeeeeeeeeeeeeeeeeeeeeeeeeeeeeeeeeeeeeeeeeeeeeeeeeeeeeeeeeeee","ordering":"plan-v1","execution_profile":null},"completion":{"kind":"complete","instant_unix_nanoseconds":2,"reasons":[],"stage":null,"code":null},"gate":{"verdict":"not-requested","profile":null,"reasons":[],"coverage":[],"assessments":[]},"summary":{"executions":[{"name":"observed","value":2}],"comparisons":[{"name":"evaluated","value":1}],"assertions":[{"name":"satisfied","value":1}],"diffs":[{"name":"equivalent","value":1}]},"executions":[{"ordinal":0,"execution_id":"execution-0","subject":{"namespace":"default","kind":"Request","resource_id":"get-items","fingerprint":"aaaaaaaaaaaaaaaaaaaaaaaaaaaaaaaaaaaaaaaaaaaaaaaaaaaaaaaaaaaaaaaa"},"environment":{"namespace":"default","kind":"Environment","resource_id":"staging","fingerprint":"aaaaaaaaaaaaaaaaaaaaaaaaaaaaaaaaaaaaaaaaaaaaaaaaaaaaaaaaaaaaaaaa"},"cell_id":"cell-0","trial_id":"trial-0","coordinates":[{"axis":"tenant","value":{"type":"integer","value":1}}],"outcome":"observed","failure":null,"timings":[{"name":"total","nanoseconds":10,"reason":null}],"attempts":[{"attempt_id":"attempt-0","exchanges":[{"exchange_id":"exchange-0","request":{"method":"GET","url":"https://example.test/items","headers":[{"name":"accept","value":"application/json","redacted":false}],"cookies":[],"body":{"source_state":"complete","extent":"complete","source_byte_count":4,"blob":{"sha256":"bbbbbbbbbbbbbbbbbbbbbbbbbbbbbbbbbbbbbbbbbbbbbbbbbbbbbbbbbbbbbbbb","byte_count":4,"media_type":"text/plain"},"reason":null,"redaction_count":0}},"request_omission":null,"response":{"status":200,"protocol":"HTTP/2","headers":[{"name":"content-type","value":"application/json","redacted":false}],"trailers":[],"body":{"source_state":"complete","extent":"complete","source_byte_count":4,"blob":{"sha256":"cccccccccccccccccccccccccccccccccccccccccccccccccccccccccccccccc","byte_count":4,"media_type":"text/plain"},"reason":null,"redaction_count":0}},"response_omission":null,"failure":null,"timings":[{"name":"total","nanoseconds":10,"reason":null}]}],"timings":[],"terminal_pre_send_request":null,"terminal_pre_send_omission":null,"failure":null}],"assertions":[{"fact_id":"assertion-fact","application_id":"assertion-application","engine":"assertion","rule":{"namespace":"default","kind":"AssertionRule","resource_id":"r","fingerprint":"aaaaaaaaaaaaaaaaaaaaaaaaaaaaaaaaaaaaaaaaaaaaaaaaaaaaaaaaaaaaaaaa"},"rule_id":"rule","effective_rule_id":"rule","severity":"blocking","outcome":"satisfied","counts":[{"name":"evaluated","value":1}],"coverage":[{"name":"selected","value":1}],"evidence":[{"fact_id":"assertion-evidence","outcome":"satisfied","location":"response.body#/value","values":[{"name":"actual","value":{"type":"decimal","value":"1.5"}}]}],"evidence_omitted":0,"issues":[]}]},{"ordinal":1,"execution_id":"execution-1","subject":{"namespace":"default","kind":"Request","resource_id":"get-items","fingerprint":"aaaaaaaaaaaaaaaaaaaaaaaaaaaaaaaaaaaaaaaaaaaaaaaaaaaaaaaaaaaaaaaa"},"environment":{"namespace":"default","kind":"Environment","resource_id":"prod","fingerprint":"aaaaaaaaaaaaaaaaaaaaaaaaaaaaaaaaaaaaaaaaaaaaaaaaaaaaaaaaaaaaaaaa"},"cell_id":"cell-0","trial_id":"trial-0","coordinates":[{"axis":"tenant","value":{"type":"integer","value":1}}],"outcome":"observed","failure":null,"timings":[{"name":"total","nanoseconds":10,"reason":null}],"attempts":[{"attempt_id":"attempt-1","exchanges":[{"exchange_id":"exchange-1","request":{"method":"GET","url":"https://example.test/items","headers":[{"name":"accept","value":"application/json","redacted":false}],"cookies":[],"body":{"source_state":"complete","extent":"complete","source_byte_count":4,"blob":{"sha256":"bbbbbbbbbbbbbbbbbbbbbbbbbbbbbbbbbbbbbbbbbbbbbbbbbbbbbbbbbbbbbbbb","byte_count":4,"media_type":"text/plain"},"reason":null,"redaction_count":0}},"request_omission":null,"response":{"status":200,"protocol":"HTTP/2","headers":[{"name":"content-type","value":"application/json","redacted":false}],"trailers":[],"body":{"source_state":"complete","extent":"complete","source_byte_count":4,"blob":{"sha256":"cccccccccccccccccccccccccccccccccccccccccccccccccccccccccccccccc","byte_count":4,"media_type":"text/plain"},"reason":null,"redaction_count":0}},"response_omission":null,"failure":null,"timings":[{"name":"total","nanoseconds":10,"reason":null}]}],"timings":[],"terminal_pre_send_request":null,"terminal_pre_send_omission":null,"failure":null}],"assertions":[]}],"comparisons":[{"ordinal":0,"comparison_id":"comparison-0","subject":{"namespace":"default","kind":"Request","resource_id":"get-items","fingerprint":"aaaaaaaaaaaaaaaaaaaaaaaaaaaaaaaaaaaaaaaaaaaaaaaaaaaaaaaaaaaaaaaa"},"cell_id":"cell-0","trial_id":"trial-0","baseline_execution_id":"execution-0","candidate_execution_id":"execution-1","outcome":"evaluated","unavailable_execution_ids":[],"diffs":[{"fact_id":"diff-fact","application_id":"diff-application","engine":"diff","rule":{"namespace":"default","kind":"DiffRule","resource_id":"r","fingerprint":"aaaaaaaaaaaaaaaaaaaaaaaaaaaaaaaaaaaaaaaaaaaaaaaaaaaaaaaaaaaaaaaa"},"rule_id":"rule","effective_rule_id":"rule","severity":"blocking","outcome":"equivalent","counts":[{"name":"evaluated","value":1}],"coverage":[{"name":"selected","value":1}],"evidence":[{"fact_id":"diff-evidence","outcome":"equivalent","location":"response.body#/value","values":[{"name":"actual","value":{"type":"decimal","value":"1.5"}}]}],"evidence_omitted":0,"issues":[]}]}],"resources":[{"namespace":"default","kind":"AssertionRule","resource_id":"r","fingerprint":"aaaaaaaaaaaaaaaaaaaaaaaaaaaaaaaaaaaaaaaaaaaaaaaaaaaaaaaaaaaaaaaa"},{"namespace":"default","kind":"DiffRule","resource_id":"r","fingerprint":"aaaaaaaaaaaaaaaaaaaaaaaaaaaaaaaaaaaaaaaaaaaaaaaaaaaaaaaaaaaaaaaa"},{"namespace":"default","kind":"Environment","resource_id":"prod","fingerprint":"aaaaaaaaaaaaaaaaaaaaaaaaaaaaaaaaaaaaaaaaaaaaaaaaaaaaaaaaaaaaaaaa"},{"namespace":"default","kind":"Environment","resource_id":"staging","fingerprint":"aaaaaaaaaaaaaaaaaaaaaaaaaaaaaaaaaaaaaaaaaaaaaaaaaaaaaaaaaaaaaaaa"},{"namespace":"default","kind":"ExecutionPolicy","resource_id":"ci","fingerprint":"aaaaaaaaaaaaaaaaaaaaaaaaaaaaaaaaaaaaaaaaaaaaaaaaaaaaaaaaaaaaaaaa"},{"namespace":"default","kind":"Project","resource_id":"project","fingerprint":"aaaaaaaaaaaaaaaaaaaaaaaaaaaaaaaaaaaaaaaaaaaaaaaaaaaaaaaaaaaaaaaa"},{"namespace":"default","kind":"Request","resource_id":"get-items","fingerprint":"aaaaaaaaaaaaaaaaaaaaaaaaaaaaaaaaaaaaaaaaaaaaaaaaaaaaaaaaaaaaaaaa"}],"budgets":[{"resource":"executions","scope":"run","limit":{"unit":"count","numerator":2,"denominator":1},"used":{"unit":"count","numerator":1,"denominator":1},"exhausted":false}],"blobs":[{"sha256":"bbbbbbbbbbbbbbbbbbbbbbbbbbbbbbbbbbbbbbbbbbbbbbbbbbbbbbbbbbbbbbbb","byte_count":4,"media_type":"text/plain"},{"sha256":"cccccccccccccccccccccccccccccccccccccccccccccccccccccccccccccccc","byte_count":4,"media_type":"text/plain"}],"coverage_issues":[],"annotations":null}}
